══════════════════════════════════════════════════════════════════
DISK DETECTION — Tue Jul 28 17:27:14 UTC 2026

Host: sysrescue
Found 7 disk(s):
  /dev/sda  →  WDC WD30EFRX-68EUZN0
  /dev/sdb  →  HGST HDN726040ALE614
  /dev/sdc  →  TOSHIBA HDWD130
  /dev/sdd  →  Crucial_CT525MX300SSD4
  /dev/sde  →  TOSHIBA HDWD130
  /dev/sdf  →  TOSHIBA HDWD130
  /dev/sdg  →  TOSHIBA HDWD130

══════════════════════════════════════════════════════════════════
❖ /dev/sda — smartctl -a

smartctl 7.5 2025-04-30 r5714 [x86_64-linux-6.18.34-1-lts] (local build)
Copyright (C) 2002-25, Bruce Allen, Christian Franke, www.smartmontools.org

=== START OF INFORMATION SECTION ===
Model Family:     Western Digital Red (CMR)
Device Model:     WDC WD30EFRX-68EUZN0
Serial Number:    WD-WCC4N6YFD1UU
LU WWN Device Id: 5 0014ee 2b831139b
Firmware Version: 82.00A82
User Capacity:    3,000,592,982,016 bytes [3.00 TB]
Sector Sizes:     512 bytes logical, 4096 bytes physical
Rotation Rate:    5400 rpm
Device is:        In smartctl database 7.5/5706
ATA Version is:   ACS-2 (minor revision not indicated)
SATA Version is:  SATA 3.0, 6.0 Gb/s (current: 3.0 Gb/s)
Local Time is:    Tue Jul 28 17:27:15 2026 UTC
SMART support is: Available - device has SMART capability.
SMART support is: Enabled

=== START OF READ SMART DATA SECTION ===
SMART overall-health self-assessment test result: PASSED

General SMART Values:
Offline data collection status:  (0x00)	Offline data collection activity
					was never started.
					Auto Offline Data Collection: Disabled.
Self-test execution status:      (   0)	The previous self-test routine completed
					without error or no self-test has ever 
					been run.
Total time to complete Offline 
data collection: 		(38580) seconds.
Offline data collection
capabilities: 			 (0x7b) SMART execute Offline immediate.
					Auto Offline data collection on/off support.
					Suspend Offline collection upon new
					command.
					Offline surface scan supported.
					Self-test supported.
					Conveyance Self-test supported.
					Selective Self-test supported.
SMART capabilities:            (0x0003)	Saves SMART data before entering
					power-saving mode.
					Supports SMART auto save timer.
Error logging capability:        (0x01)	Error logging supported.
					General Purpose Logging supported.
Short self-test routine 
recommended polling time: 	 (   2) minutes.
Extended self-test routine
recommended polling time: 	 ( 387) minutes.
Conveyance self-test routine
recommended polling time: 	 (   5) minutes.
SCT capabilities: 	       (0x703d)	SCT Status supported.
					SCT Error Recovery Control supported.
					SCT Feature Control supported.
					SCT Data Table supported.

SMART Attributes Data Structure revision number: 16
Vendor Specific SMART Attributes with Thresholds:
ID# ATTRIBUTE_NAME          FLAG     VALUE WORST THRESH TYPE      UPDATED  WHEN_FAILED RAW_VALUE
  1 Raw_Read_Error_Rate     0x002f   200   200   051    Pre-fail  Always       -       0
  3 Spin_Up_Time            0x0027   176   175   021    Pre-fail  Always       -       6200
  4 Start_Stop_Count        0x0032   098   098   000    Old_age   Always       -       2926
  5 Reallocated_Sector_Ct   0x0033   200   200   140    Pre-fail  Always       -       0
  7 Seek_Error_Rate         0x002e   200   200   000    Old_age   Always       -       0
  9 Power_On_Hours          0x0032   038   038   000    Old_age   Always       -       45500
 10 Spin_Retry_Count        0x0032   100   100   000    Old_age   Always       -       0
 11 Calibration_Retry_Count 0x0032   100   100   000    Old_age   Always       -       0
 12 Power_Cycle_Count       0x0032   100   100   000    Old_age   Always       -       146
192 Power-Off_Retract_Count 0x0032   200   200   000    Old_age   Always       -       45
193 Load_Cycle_Count        0x0032   182   182   000    Old_age   Always       -       55998
194 Temperature_Celsius     0x0022   117   104   000    Old_age   Always       -       33
196 Reallocated_Event_Count 0x0032   200   200   000    Old_age   Always       -       0
197 Current_Pending_Sector  0x0032   200   200   000    Old_age   Always       -       0
198 Offline_Uncorrectable   0x0030   100   253   000    Old_age   Offline      -       0
199 UDMA_CRC_Error_Count    0x0032   200   200   000    Old_age   Always       -       0
200 Multi_Zone_Error_Rate   0x0008   100   253   000    Old_age   Offline      -       0

SMART Error Log Version: 1
No Errors Logged

SMART Self-test log structure revision number 1
Num  Test_Description    Status                  Remaining  LifeTime(hours)  LBA_of_first_error
# 1  Short offline       Completed without error       00%         0         -

SMART Selective self-test log data structure revision number 1
 SPAN  MIN_LBA  MAX_LBA  CURRENT_TEST_STATUS
    1        0        0  Not_testing
    2        0        0  Not_testing
    3        0        0  Not_testing
    4        0        0  Not_testing
    5        0        0  Not_testing
Selective self-test flags (0x0):
  After scanning selected spans, do NOT read-scan remainder of disk.
If Selective self-test is pending on power-up, resume after 0 minute delay.

The above only provides legacy SMART information - try 'smartctl -x' for more


══════════════════════════════════════════════════════════════════
❖ /dev/sdb — smartctl -a

smartctl 7.5 2025-04-30 r5714 [x86_64-linux-6.18.34-1-lts] (local build)
Copyright (C) 2002-25, Bruce Allen, Christian Franke, www.smartmontools.org

=== START OF INFORMATION SECTION ===
Model Family:     HGST Deskstar NAS
Device Model:     HGST HDN726040ALE614
Serial Number:    K4K9LBGB
LU WWN Device Id: 5 000cca 25deea2cf
Firmware Version: APGNW7JH
User Capacity:    4,000,787,030,016 bytes [4.00 TB]
Sector Sizes:     512 bytes logical, 4096 bytes physical
Rotation Rate:    7200 rpm
Form Factor:      3.5 inches
Device is:        In smartctl database 7.5/5706
ATA Version is:   ACS-2, ATA8-ACS T13/1699-D revision 4
SATA Version is:  SATA 3.1, 6.0 Gb/s (current: 3.0 Gb/s)
Local Time is:    Tue Jul 28 17:27:15 2026 UTC
SMART support is: Available - device has SMART capability.
SMART support is: Enabled

=== START OF READ SMART DATA SECTION ===
SMART overall-health self-assessment test result: PASSED

General SMART Values:
Offline data collection status:  (0x80)	Offline data collection activity
					was never started.
					Auto Offline Data Collection: Enabled.
Self-test execution status:      (   0)	The previous self-test routine completed
					without error or no self-test has ever 
					been run.
Total time to complete Offline 
data collection: 		(  113) seconds.
Offline data collection
capabilities: 			 (0x5b) SMART execute Offline immediate.
					Auto Offline data collection on/off support.
					Suspend Offline collection upon new
					command.
					Offline surface scan supported.
					Self-test supported.
					No Conveyance Self-test supported.
					Selective Self-test supported.
SMART capabilities:            (0x0003)	Saves SMART data before entering
					power-saving mode.
					Supports SMART auto save timer.
Error logging capability:        (0x01)	Error logging supported.
					General Purpose Logging supported.
Short self-test routine 
recommended polling time: 	 (   2) minutes.
Extended self-test routine
recommended polling time: 	 ( 571) minutes.
SCT capabilities: 	       (0x003d)	SCT Status supported.
					SCT Error Recovery Control supported.
					SCT Feature Control supported.
					SCT Data Table supported.

SMART Attributes Data Structure revision number: 16
Vendor Specific SMART Attributes with Thresholds:
ID# ATTRIBUTE_NAME          FLAG     VALUE WORST THRESH TYPE      UPDATED  WHEN_FAILED RAW_VALUE
  1 Raw_Read_Error_Rate     0x000b   100   100   016    Pre-fail  Always       -       0
  2 Throughput_Performance  0x0005   136   136   054    Pre-fail  Offline      -       108
  3 Spin_Up_Time            0x0007   151   151   024    Pre-fail  Always       -       383 (Average 325)
  4 Start_Stop_Count        0x0012   100   100   000    Old_age   Always       -       51
  5 Reallocated_Sector_Ct   0x0033   100   100   005    Pre-fail  Always       -       0
  7 Seek_Error_Rate         0x000b   100   100   067    Pre-fail  Always       -       0
  8 Seek_Time_Performance   0x0005   128   128   020    Pre-fail  Offline      -       18
  9 Power_On_Hours          0x0012   092   092   000    Old_age   Always       -       60070
 10 Spin_Retry_Count        0x0013   100   100   060    Pre-fail  Always       -       0
 12 Power_Cycle_Count       0x0032   100   100   000    Old_age   Always       -       47
192 Power-Off_Retract_Count 0x0032   096   096   000    Old_age   Always       -       5426
193 Load_Cycle_Count        0x0012   096   096   000    Old_age   Always       -       5426
194 Temperature_Celsius     0x0002   146   146   000    Old_age   Always       -       41 (Min/Max 17/51)
196 Reallocated_Event_Count 0x0032   100   100   000    Old_age   Always       -       0
197 Current_Pending_Sector  0x0022   100   100   000    Old_age   Always       -       0
198 Offline_Uncorrectable   0x0008   100   100   000    Old_age   Offline      -       0
199 UDMA_CRC_Error_Count    0x000a   200   200   000    Old_age   Always       -       0

SMART Error Log Version: 1
No Errors Logged

SMART Self-test log structure revision number 1
No self-tests have been logged.  [To run self-tests, use: smartctl -t]

SMART Selective self-test log data structure revision number 1
 SPAN  MIN_LBA  MAX_LBA  CURRENT_TEST_STATUS
    1        0        0  Not_testing
    2        0        0  Not_testing
    3        0        0  Not_testing
    4        0        0  Not_testing
    5        0        0  Not_testing
Selective self-test flags (0x0):
  After scanning selected spans, do NOT read-scan remainder of disk.
If Selective self-test is pending on power-up, resume after 0 minute delay.

The above only provides legacy SMART information - try 'smartctl -x' for more


══════════════════════════════════════════════════════════════════
❖ /dev/sdc — smartctl -a

smartctl 7.5 2025-04-30 r5714 [x86_64-linux-6.18.34-1-lts] (local build)
Copyright (C) 2002-25, Bruce Allen, Christian Franke, www.smartmontools.org

=== START OF INFORMATION SECTION ===
Model Family:     Toshiba P300 (CMR)
Device Model:     TOSHIBA HDWD130
Serial Number:    98M0ZZYAS
LU WWN Device Id: 5 000039 fe6eabae0
Firmware Version: MX6OACF0
User Capacity:    3,000,592,982,016 bytes [3.00 TB]
Sector Sizes:     512 bytes logical, 4096 bytes physical
Rotation Rate:    7200 rpm
Form Factor:      3.5 inches
Device is:        In smartctl database 7.5/5706
ATA Version is:   ATA8-ACS T13/1699-D revision 4
SATA Version is:  SATA 3.0, 6.0 Gb/s (current: 6.0 Gb/s)
Local Time is:    Tue Jul 28 17:27:15 2026 UTC
SMART support is: Available - device has SMART capability.
SMART support is: Enabled

=== START OF READ SMART DATA SECTION ===
SMART overall-health self-assessment test result: PASSED

General SMART Values:
Offline data collection status:  (0x84)	Offline data collection activity
					was suspended by an interrupting command from host.
					Auto Offline Data Collection: Enabled.
Self-test execution status:      (   0)	The previous self-test routine completed
					without error or no self-test has ever 
					been run.
Total time to complete Offline 
data collection: 		(21791) seconds.
Offline data collection
capabilities: 			 (0x5b) SMART execute Offline immediate.
					Auto Offline data collection on/off support.
					Suspend Offline collection upon new
					command.
					Offline surface scan supported.
					Self-test supported.
					No Conveyance Self-test supported.
					Selective Self-test supported.
SMART capabilities:            (0x0003)	Saves SMART data before entering
					power-saving mode.
					Supports SMART auto save timer.
Error logging capability:        (0x01)	Error logging supported.
					General Purpose Logging supported.
Short self-test routine 
recommended polling time: 	 (   1) minutes.
Extended self-test routine
recommended polling time: 	 ( 364) minutes.
SCT capabilities: 	       (0x003d)	SCT Status supported.
					SCT Error Recovery Control supported.
					SCT Feature Control supported.
					SCT Data Table supported.

SMART Attributes Data Structure revision number: 16
Vendor Specific SMART Attributes with Thresholds:
ID# ATTRIBUTE_NAME          FLAG     VALUE WORST THRESH TYPE      UPDATED  WHEN_FAILED RAW_VALUE
  1 Raw_Read_Error_Rate     0x000b   100   100   016    Pre-fail  Always       -       0
  2 Throughput_Performance  0x0005   140   140   054    Pre-fail  Offline      -       68
  3 Spin_Up_Time            0x0007   100   100   024    Pre-fail  Always       -       352
  4 Start_Stop_Count        0x0012   100   100   000    Old_age   Always       -       9
  5 Reallocated_Sector_Ct   0x0033   100   100   005    Pre-fail  Always       -       0
  7 Seek_Error_Rate         0x000b   100   100   067    Pre-fail  Always       -       0
  8 Seek_Time_Performance   0x0005   124   124   020    Pre-fail  Offline      -       33
  9 Power_On_Hours          0x0012   100   100   000    Old_age   Always       -       6481
 10 Spin_Retry_Count        0x0013   100   100   060    Pre-fail  Always       -       0
 12 Power_Cycle_Count       0x0032   100   100   000    Old_age   Always       -       9
192 Power-Off_Retract_Count 0x0032   100   100   000    Old_age   Always       -       192
193 Load_Cycle_Count        0x0012   100   100   000    Old_age   Always       -       192
194 Temperature_Celsius     0x0002   171   171   000    Old_age   Always       -       35 (Min/Max 21/52)
196 Reallocated_Event_Count 0x0032   100   100   000    Old_age   Always       -       0
197 Current_Pending_Sector  0x0022   100   100   000    Old_age   Always       -       0
198 Offline_Uncorrectable   0x0008   100   100   000    Old_age   Offline      -       0
199 UDMA_CRC_Error_Count    0x000a   200   200   000    Old_age   Always       -       0

SMART Error Log Version: 1
No Errors Logged

SMART Self-test log structure revision number 1
No self-tests have been logged.  [To run self-tests, use: smartctl -t]

SMART Selective self-test log data structure revision number 1
 SPAN  MIN_LBA  MAX_LBA  CURRENT_TEST_STATUS
    1        0        0  Not_testing
    2        0        0  Not_testing
    3        0        0  Not_testing
    4        0        0  Not_testing
    5        0        0  Not_testing
Selective self-test flags (0x0):
  After scanning selected spans, do NOT read-scan remainder of disk.
If Selective self-test is pending on power-up, resume after 0 minute delay.

The above only provides legacy SMART information - try 'smartctl -x' for more


══════════════════════════════════════════════════════════════════
❖ /dev/sdd — smartctl -a

smartctl 7.5 2025-04-30 r5714 [x86_64-linux-6.18.34-1-lts] (local build)
Copyright (C) 2002-25, Bruce Allen, Christian Franke, www.smartmontools.org

=== START OF INFORMATION SECTION ===
Model Family:     Crucial/Micron Client SSDs
Device Model:     Crucial_CT525MX300SSD4
Serial Number:    173818D02FF0
LU WWN Device Id: 5 00a075 118d02ff0
Firmware Version: M0CR060
User Capacity:    525,112,713,216 bytes [525 GB]
Sector Size:      512 bytes logical/physical
Rotation Rate:    Solid State Device
Form Factor:      < 1.8 inches
TRIM Command:     Available, deterministic, zeroed
Device is:        In smartctl database 7.5/5706
ATA Version is:   ACS-3 T13/2161-D revision 5
SATA Version is:  SATA 3.2, 6.0 Gb/s (current: 6.0 Gb/s)
Local Time is:    Tue Jul 28 17:27:17 2026 UTC
SMART support is: Available - device has SMART capability.
SMART support is: Enabled

=== START OF READ SMART DATA SECTION ===
SMART overall-health self-assessment test result: PASSED

General SMART Values:
Offline data collection status:  (0x00)	Offline data collection activity
					was never started.
					Auto Offline Data Collection: Disabled.
Self-test execution status:      (   0)	The previous self-test routine completed
					without error or no self-test has ever 
					been run.
Total time to complete Offline 
data collection: 		( 1391) seconds.
Offline data collection
capabilities: 			 (0x7b) SMART execute Offline immediate.
					Auto Offline data collection on/off support.
					Suspend Offline collection upon new
					command.
					Offline surface scan supported.
					Self-test supported.
					Conveyance Self-test supported.
					Selective Self-test supported.
SMART capabilities:            (0x0003)	Saves SMART data before entering
					power-saving mode.
					Supports SMART auto save timer.
Error logging capability:        (0x01)	Error logging supported.
					General Purpose Logging supported.
Short self-test routine 
recommended polling time: 	 (   2) minutes.
Extended self-test routine
recommended polling time: 	 (   7) minutes.
Conveyance self-test routine
recommended polling time: 	 (   3) minutes.
SCT capabilities: 	       (0x0035)	SCT Status supported.
					SCT Feature Control supported.
					SCT Data Table supported.

SMART Attributes Data Structure revision number: 16
Vendor Specific SMART Attributes with Thresholds:
ID# ATTRIBUTE_NAME          FLAG     VALUE WORST THRESH TYPE      UPDATED  WHEN_FAILED RAW_VALUE
  1 Raw_Read_Error_Rate     0x002f   100   100   000    Pre-fail  Always       -       0
  5 Reallocate_NAND_Blk_Cnt 0x0032   100   100   010    Old_age   Always       -       0
  9 Power_On_Hours          0x0032   100   100   000    Old_age   Always       -       55828
 12 Power_Cycle_Count       0x0032   100   100   000    Old_age   Always       -       124
171 Program_Fail_Count      0x0032   100   100   000    Old_age   Always       -       0
172 Erase_Fail_Count        0x0032   100   100   000    Old_age   Always       -       0
173 Ave_Block-Erase_Count   0x0032   019   019   000    Old_age   Always       -       1216
174 Unexpect_Power_Loss_Ct  0x0032   100   100   000    Old_age   Always       -       41
183 SATA_Interfac_Downshift 0x0032   100   100   000    Old_age   Always       -       0
184 Error_Correction_Count  0x0032   100   100   000    Old_age   Always       -       0
187 Reported_Uncorrect      0x0032   100   100   000    Old_age   Always       -       0
194 Temperature_Celsius     0x0022   069   036   000    Old_age   Always       -       31 (Min/Max 12/64)
196 Reallocated_Event_Count 0x0032   100   100   000    Old_age   Always       -       0
197 Current_Pending_ECC_Cnt 0x0032   100   100   000    Old_age   Always       -       0
198 Offline_Uncorrectable   0x0030   100   100   000    Old_age   Offline      -       0
199 UDMA_CRC_Error_Count    0x0032   100   100   000    Old_age   Always       -       0
202 Percent_Lifetime_Remain 0x0030   019   019   001    Old_age   Offline      -       81
206 Write_Error_Rate        0x000e   100   100   000    Old_age   Always       -       0
246 Total_LBAs_Written      0x0032   100   100   000    Old_age   Always       -       132735125889
247 Host_Program_Page_Count 0x0032   100   100   000    Old_age   Always       -       4147973418
248 FTL_Program_Page_Count  0x0032   100   100   000    Old_age   Always       -       29830025736
180 Unused_Reserve_NAND_Blk 0x0033   000   000   000    Pre-fail  Always       -       1931
210 Success_RAIN_Recov_Cnt  0x0032   100   100   000    Old_age   Always       -       0

SMART Error Log Version: 1
No Errors Logged

SMART Self-test log structure revision number 1
Num  Test_Description    Status                  Remaining  LifeTime(hours)  LBA_of_first_error
# 1  Vendor (0xff)       Completed without error       00%     55802         -
# 2  Vendor (0xff)       Completed without error       00%     55568         -
# 3  Vendor (0xff)       Completed without error       00%     55232         -
# 4  Vendor (0xff)       Completed without error       00%     54918         -
# 5  Vendor (0xff)       Completed without error       00%     54605         -
# 6  Vendor (0xff)       Completed without error       00%     54272         -
# 7  Vendor (0xff)       Completed without error       00%     53934         -
# 8  Vendor (0xff)       Completed without error       00%     53618         -
# 9  Vendor (0xff)       Completed without error       00%     53291         -
#10  Vendor (0xff)       Completed without error       00%     52974         -
#11  Vendor (0xff)       Completed without error       00%     52656         -
#12  Vendor (0xff)       Completed without error       00%     52344         -
#13  Vendor (0xff)       Completed without error       00%     52035         -
#14  Vendor (0xff)       Completed without error       00%     51722         -
#15  Vendor (0xff)       Completed without error       00%     51411         -
#16  Vendor (0xff)       Completed without error       00%     51096         -
#17  Vendor (0xff)       Completed without error       00%     50781         -
#18  Vendor (0xff)       Completed without error       00%     50474         -
#19  Vendor (0xff)       Completed without error       00%     44054         -
#20  Vendor (0xff)       Completed without error       00%     43966         -
#21  Vendor (0xff)       Completed without error       00%     43655         -

SMART Selective self-test log data structure revision number 1
 SPAN  MIN_LBA  MAX_LBA  CURRENT_TEST_STATUS
    1        0        0  Not_testing
    2        0        0  Not_testing
    3        0        0  Not_testing
    4        0        0  Not_testing
    5        0        0  Not_testing
Selective self-test flags (0x0):
  After scanning selected spans, do NOT read-scan remainder of disk.
If Selective self-test is pending on power-up, resume after 0 minute delay.

The above only provides legacy SMART information - try 'smartctl -x' for more


══════════════════════════════════════════════════════════════════
❖ /dev/sde — smartctl -a

smartctl 7.5 2025-04-30 r5714 [x86_64-linux-6.18.34-1-lts] (local build)
Copyright (C) 2002-25, Bruce Allen, Christian Franke, www.smartmontools.org

=== START OF INFORMATION SECTION ===
Model Family:     Toshiba P300 (CMR)
Device Model:     TOSHIBA HDWD130
Serial Number:    98M0WYTAS
LU WWN Device Id: 5 000039 fe6eaaf79
Firmware Version: MX6OACF0
User Capacity:    3,000,592,982,016 bytes [3.00 TB]
Sector Sizes:     512 bytes logical, 4096 bytes physical
Rotation Rate:    7200 rpm
Form Factor:      3.5 inches
Device is:        In smartctl database 7.5/5706
ATA Version is:   ATA8-ACS T13/1699-D revision 4
SATA Version is:  SATA 3.0, 6.0 Gb/s (current: 6.0 Gb/s)
Local Time is:    Tue Jul 28 17:27:17 2026 UTC
SMART support is: Available - device has SMART capability.
SMART support is: Enabled

=== START OF READ SMART DATA SECTION ===
SMART overall-health self-assessment test result: FAILED!
Drive failure expected in less than 24 hours. SAVE ALL DATA.
See vendor-specific Attribute list for failed Attributes.

General SMART Values:
Offline data collection status:  (0x84)	Offline data collection activity
					was suspended by an interrupting command from host.
					Auto Offline Data Collection: Enabled.
Self-test execution status:      (   0)	The previous self-test routine completed
					without error or no self-test has ever 
					been run.
Total time to complete Offline 
data collection: 		(20644) seconds.
Offline data collection
capabilities: 			 (0x5b) SMART execute Offline immediate.
					Auto Offline data collection on/off support.
					Suspend Offline collection upon new
					command.
					Offline surface scan supported.
					Self-test supported.
					No Conveyance Self-test supported.
					Selective Self-test supported.
SMART capabilities:            (0x0003)	Saves SMART data before entering
					power-saving mode.
					Supports SMART auto save timer.
Error logging capability:        (0x01)	Error logging supported.
					General Purpose Logging supported.
Short self-test routine 
recommended polling time: 	 (   1) minutes.
Extended self-test routine
recommended polling time: 	 ( 344) minutes.
SCT capabilities: 	       (0x003d)	SCT Status supported.
					SCT Error Recovery Control supported.
					SCT Feature Control supported.
					SCT Data Table supported.

SMART Attributes Data Structure revision number: 16
Vendor Specific SMART Attributes with Thresholds:
ID# ATTRIBUTE_NAME          FLAG     VALUE WORST THRESH TYPE      UPDATED  WHEN_FAILED RAW_VALUE
  1 Raw_Read_Error_Rate     0x000b   083   083   016    Pre-fail  Always       -       30081024
  2 Throughput_Performance  0x0005   141   141   054    Pre-fail  Offline      -       65
  3 Spin_Up_Time            0x0007   150   150   024    Pre-fail  Always       -       427 (Average 337)
  4 Start_Stop_Count        0x0012   100   100   000    Old_age   Always       -       11
  5 Reallocated_Sector_Ct   0x0033   001   001   005    Pre-fail  Always   FAILING_NOW 2001
  7 Seek_Error_Rate         0x000b   100   100   067    Pre-fail  Always       -       0
  8 Seek_Time_Performance   0x0005   124   124   020    Pre-fail  Offline      -       33
  9 Power_On_Hours          0x0012   099   099   000    Old_age   Always       -       8156
 10 Spin_Retry_Count        0x0013   100   100   060    Pre-fail  Always       -       0
 12 Power_Cycle_Count       0x0032   100   100   000    Old_age   Always       -       11
192 Power-Off_Retract_Count 0x0032   100   100   000    Old_age   Always       -       140
193 Load_Cycle_Count        0x0012   100   100   000    Old_age   Always       -       140
194 Temperature_Celsius     0x0002   171   171   000    Old_age   Always       -       35 (Min/Max 22/53)
196 Reallocated_Event_Count 0x0032   001   001   000    Old_age   Always       -       2051
197 Current_Pending_Sector  0x0022   100   100   000    Old_age   Always       -       32
198 Offline_Uncorrectable   0x0008   100   100   000    Old_age   Offline      -       0
199 UDMA_CRC_Error_Count    0x000a   200   200   000    Old_age   Always       -       0

SMART Error Log Version: 1
No Errors Logged

SMART Self-test log structure revision number 1
No self-tests have been logged.  [To run self-tests, use: smartctl -t]

SMART Selective self-test log data structure revision number 1
 SPAN  MIN_LBA  MAX_LBA  CURRENT_TEST_STATUS
    1        0        0  Not_testing
    2        0        0  Not_testing
    3        0        0  Not_testing
    4        0        0  Not_testing
    5        0        0  Not_testing
Selective self-test flags (0x0):
  After scanning selected spans, do NOT read-scan remainder of disk.
If Selective self-test is pending on power-up, resume after 0 minute delay.

The above only provides legacy SMART information - try 'smartctl -x' for more


══════════════════════════════════════════════════════════════════
❖ /dev/sdf — smartctl -a
smartctl 7.5 2025-04-30 r5714 [x86_64-linux-6.18.34-1-lts] (local build)
Copyright (C) 2002-25, Bruce Allen, Christian Franke, www.smartmontools.org

=== START OF INFORMATION SECTION ===
Model Family:     Toshiba P300 (CMR)
Device Model:     TOSHIBA HDWD130
Serial Number:    98M0X0TAS
LU WWN Device Id: 5 000039 fe6eaafb7
Firmware Version: MX6OACF0
User Capacity:    3,000,592,982,016 bytes [3.00 TB]
Sector Sizes:     512 bytes logical, 4096 bytes physical
Rotation Rate:    7200 rpm
Form Factor:      3.5 inches
Device is:        In smartctl database 7.5/5706
ATA Version is:   ATA8-ACS T13/1699-D revision 4
SATA Version is:  SATA 3.0, 6.0 Gb/s (current: 6.0 Gb/s)
Local Time is:    Tue Jul 28 17:28:45 2026 UTC
SMART support is: Available - device has SMART capability.
SMART support is: Enabled

=== START OF READ SMART DATA SECTION ===
SMART overall-health self-assessment test result: PASSED

General SMART Values:
Offline data collection status:  (0x80)	Offline data collection activity
					was never started.
					Auto Offline Data Collection: Enabled.
Self-test execution status:      (   0)	The previous self-test routine completed
					without error or no self-test has ever 
					been run.
Total time to complete Offline 
data collection: 		(21935) seconds.
Offline data collection
capabilities: 			 (0x5b) SMART execute Offline immediate.
					Auto Offline data collection on/off support.
					Suspend Offline collection upon new
					command.
					Offline surface scan supported.
					Self-test supported.
					No Conveyance Self-test supported.
					Selective Self-test supported.
SMART capabilities:            (0x0003)	Saves SMART data before entering
					power-saving mode.
					Supports SMART auto save timer.
Error logging capability:        (0x01)	Error logging supported.
					General Purpose Logging supported.
Short self-test routine 
recommended polling time: 	 (   1) minutes.
Extended self-test routine
recommended polling time: 	 ( 366) minutes.
SCT capabilities: 	       (0x003d)	SCT Status supported.
					SCT Error Recovery Control supported.
					SCT Feature Control supported.
					SCT Data Table supported.

SMART Attributes Data Structure revision number: 16
Vendor Specific SMART Attributes with Thresholds:
ID# ATTRIBUTE_NAME          FLAG     VALUE WORST THRESH TYPE      UPDATED  WHEN_FAILED RAW_VALUE
  1 Raw_Read_Error_Rate     0x000b   100   100   016    Pre-fail  Always       -       0
  2 Throughput_Performance  0x0005   139   139   054    Pre-fail  Offline      -       70
  3 Spin_Up_Time            0x0007   147   147   024    Pre-fail  Always       -       432 (Average 349)
  4 Start_Stop_Count        0x0012   100   100   000    Old_age   Always       -       10
  5 Reallocated_Sector_Ct   0x0033   100   100   005    Pre-fail  Always       -       0
  7 Seek_Error_Rate         0x000b   100   100   067    Pre-fail  Always       -       0
  8 Seek_Time_Performance   0x0005   124   124   020    Pre-fail  Offline      -       33
  9 Power_On_Hours          0x0012   099   099   000    Old_age   Always       -       8093
 10 Spin_Retry_Count        0x0013   100   100   060    Pre-fail  Always       -       0
 12 Power_Cycle_Count       0x0032   100   100   000    Old_age   Always       -       10
192 Power-Off_Retract_Count 0x0032   100   100   000    Old_age   Always       -       80
193 Load_Cycle_Count        0x0012   100   100   000    Old_age   Always       -       80
194 Temperature_Celsius     0x0002   181   181   000    Old_age   Always       -       33 (Min/Max 21/55)
196 Reallocated_Event_Count 0x0032   100   100   000    Old_age   Always       -       0
197 Current_Pending_Sector  0x0022   100   100   000    Old_age   Always       -       0
198 Offline_Uncorrectable   0x0008   100   100   000    Old_age   Offline      -       0
199 UDMA_CRC_Error_Count    0x000a   200   200   000    Old_age   Always       -       0

SMART Error Log Version: 1
No Errors Logged

SMART Self-test log structure revision number 1
No self-tests have been logged.  [To run self-tests, use: smartctl -t]

SMART Selective self-test log data structure revision number 1
 SPAN  MIN_LBA  MAX_LBA  CURRENT_TEST_STATUS
    1        0        0  Not_testing
    2        0        0  Not_testing
    3        0        0  Not_testing
    4        0        0  Not_testing
    5        0        0  Not_testing
Selective self-test flags (0x0):
  After scanning selected spans, do NOT read-scan remainder of disk.
If Selective self-test is pending on power-up, resume after 0 minute delay.

The above only provides legacy SMART information - try 'smartctl -x' for more


══════════════════════════════════════════════════════════════════
❖ /dev/sdg — smartctl -a
smartctl 7.5 2025-04-30 r5714 [x86_64-linux-6.18.34-1-lts] (local build)
Copyright (C) 2002-25, Bruce Allen, Christian Franke, www.smartmontools.org

=== START OF INFORMATION SECTION ===
Model Family:     Toshiba P300 (CMR)
Device Model:     TOSHIBA HDWD130
Serial Number:    98M101SAS
LU WWN Device Id: 5 000039 fe6eabb18
Firmware Version: MX6OACF0
User Capacity:    3,000,592,982,016 bytes [3.00 TB]
Sector Sizes:     512 bytes logical, 4096 bytes physical
Rotation Rate:    7200 rpm
Form Factor:      3.5 inches
Device is:        In smartctl database 7.5/5706
ATA Version is:   ATA8-ACS T13/1699-D revision 4
SATA Version is:  SATA 3.0, 6.0 Gb/s (current: 6.0 Gb/s)
Local Time is:    Tue Jul 28 17:28:46 2026 UTC
SMART support is: Available - device has SMART capability.
SMART support is: Enabled

=== START OF READ SMART DATA SECTION ===
SMART overall-health self-assessment test result: PASSED

General SMART Values:
Offline data collection status:  (0x80)	Offline data collection activity
					was never started.
					Auto Offline Data Collection: Enabled.
Self-test execution status:      (   0)	The previous self-test routine completed
					without error or no self-test has ever 
					been run.
Total time to complete Offline 
data collection: 		(21074) seconds.
Offline data collection
capabilities: 			 (0x5b) SMART execute Offline immediate.
					Auto Offline data collection on/off support.
					Suspend Offline collection upon new
					command.
					Offline surface scan supported.
					Self-test supported.
					No Conveyance Self-test supported.
					Selective Self-test supported.
SMART capabilities:            (0x0003)	Saves SMART data before entering
					power-saving mode.
					Supports SMART auto save timer.
Error logging capability:        (0x01)	Error logging supported.
					General Purpose Logging supported.
Short self-test routine 
recommended polling time: 	 (   1) minutes.
Extended self-test routine
recommended polling time: 	 ( 352) minutes.
SCT capabilities: 	       (0x003d)	SCT Status supported.
					SCT Error Recovery Control supported.
					SCT Feature Control supported.
					SCT Data Table supported.

SMART Attributes Data Structure revision number: 16
Vendor Specific SMART Attributes with Thresholds:
ID# ATTRIBUTE_NAME          FLAG     VALUE WORST THRESH TYPE      UPDATED  WHEN_FAILED RAW_VALUE
  1 Raw_Read_Error_Rate     0x000b   100   100   016    Pre-fail  Always       -       0
  2 Throughput_Performance  0x0005   141   141   054    Pre-fail  Offline      -       66
  3 Spin_Up_Time            0x0007   145   145   024    Pre-fail  Always       -       436 (Average 355)
  4 Start_Stop_Count        0x0012   100   100   000    Old_age   Always       -       10
  5 Reallocated_Sector_Ct   0x0033   100   100   005    Pre-fail  Always       -       0
  7 Seek_Error_Rate         0x000b   100   100   067    Pre-fail  Always       -       0
  8 Seek_Time_Performance   0x0005   124   124   020    Pre-fail  Offline      -       33
  9 Power_On_Hours          0x0012   099   099   000    Old_age   Always       -       8156
 10 Spin_Retry_Count        0x0013   100   100   060    Pre-fail  Always       -       0
 12 Power_Cycle_Count       0x0032   100   100   000    Old_age   Always       -       10
192 Power-Off_Retract_Count 0x0032   100   100   000    Old_age   Always       -       55
193 Load_Cycle_Count        0x0012   100   100   000    Old_age   Always       -       55
194 Temperature_Celsius     0x0002   176   176   000    Old_age   Always       -       34 (Min/Max 21/55)
196 Reallocated_Event_Count 0x0032   100   100   000    Old_age   Always       -       0
197 Current_Pending_Sector  0x0022   100   100   000    Old_age   Always       -       0
198 Offline_Uncorrectable   0x0008   100   100   000    Old_age   Offline      -       0
199 UDMA_CRC_Error_Count    0x000a   200   200   000    Old_age   Always       -       0

SMART Error Log Version: 1
No Errors Logged

SMART Self-test log structure revision number 1
No self-tests have been logged.  [To run self-tests, use: smartctl -t]

SMART Selective self-test log data structure revision number 1
 SPAN  MIN_LBA  MAX_LBA  CURRENT_TEST_STATUS
    1        0        0  Not_testing
    2        0        0  Not_testing
    3        0        0  Not_testing
    4        0        0  Not_testing
    5        0        0  Not_testing
Selective self-test flags (0x0):
  After scanning selected spans, do NOT read-scan remainder of disk.
If Selective self-test is pending on power-up, resume after 0 minute delay.

The above only provides legacy SMART information - try 'smartctl -x' for more



══════════════════════════════════════════════════════════════════
SUMMARY TABLE

DEVICE   | MODEL                | SIZE  | HOURS    | REALL | PEND  | UNCOR | SPINUP | TEMP   | HEALTH
─────────┼──────────────────────┼───────┼──────────┼───────┼───────┼───────┼───────┼────────┼───────
sda      | WDC WD30EFRX-68EUZN0 | 3.00 TB | -        | -     | 0     | 0     | -     | 33     | OK   
sdb      | HGST HDN726040ALE614 | 4.00 TB | -        | -     | 0     | 0     | -     | 41     | OK   
sdc      | TOSHIBA HDWD130      | 3.00 TB | -        | -     | 0     | 0     | -     | 35     | OK   
sdd      | Crucial_CT525MX300SS | 525 GB | -        | 0     | 0     | 0     | -     | 32     | OK   

══════════════════════════════════════════════════════════════════
SUMMARY TABLE

DEVICE   | MODEL                | SIZE  | HOURS    | REALL | PEND  | UNCOR | SPINUP | TEMP   | HEALTH    
─────────┼──────────────────────┼───────┼──────────┼───────┼───────┼───────┼───────┼────────┼──────────
sda      | WDC WD30EFRX-68EUZN0 | 3.00 TB | -        | -     | 0     | 0     | -     | 33     | OK        
sdb      | HGST HDN726040ALE614 | 4.00 TB | -        | -     | 0     | 0     | -     | 41     | OK        
sdc      | TOSHIBA HDWD130      | 3.00 TB | -        | -     | 0     | 0     | -     | 34     | OK        
sdd      | Crucial_CT525MX300SS | 525 GB | -        | 0     | 0     | 0     | -     | 32     | OK        
sde      | TOSHIBA HDWD130      | 3.00 TB | -        | FAILING_NOW | 32    | 0     | -     | 35     | WARN(p=32)
sdf      | TOSHIBA HDWD130      | 3.00 TB | -        | -     | 0     | 0     | -     | 33     | OK        
sdg      | TOSHIBA HDWD130      | 3.00 TB | -        | -     | 0     | 0     | -     | 34     | OK        

══════════════════════════════════════════════════════════════════
SUMMARY TABLE

DEVICE   | MODEL                     | SIZE   | HOURS    | REALL  | PEND   | UNCOR  | SPINUP | TEMP  | HEALTH      
─────────┼───────────────────────────┼────────┼──────────┼────────┼────────┼────────┼────────┼───────┼──────────────
sda      | WDC WD30EFRX-68EUZN0      | 3.00 TB | 45500    | 0      | 0      | 0      | 6200   | 33    | OK          
sdb      | HGST HDN726040ALE614      | 4.00 TB | 60070    | 0      | 0      | 0      | 325)   | 17/51) | OK          
sdc      | TOSHIBA HDWD130           | 3.00 TB | 6481     | 0      | 0      | 0      | 352    | 21/52) | OK          
sdd      | Crucial_CT525MX300SSD4    | 525 GB | 55828    | 0      | 0      | 0      | -      | 12/64) | OK          
sde      | TOSHIBA HDWD130           | 3.00 TB | 8156     | 2001   | 32     | 0      | 337)   | 22/53) | CRITICAL    
sdf      | TOSHIBA HDWD130           | 3.00 TB | 8093     | 0      | 0      | 0      | 349)   | 21/55) | OK          
sdg      | TOSHIBA HDWD130           | 3.00 TB | 8156     | 0      | 0      | 0      | 355)   | 21/55) | OK          

